Id,Domanda,Opzione corretta,Opzioni
360,"Qual è la soglia di rilevanza europea, indicata all'art.14 del D.Lgs. 36/2023, per gli appalti pubblici di forniture, di servizi e per i concorsi pubblici di progettazione aggiudicati dalle stazioni appaltanti che sono autorità governative centrali ?",a,"a) Euro 140.000
 b) Si, devono essere pubblicati nella sezione ""Amministrazione trasparente""
 c) Si, devono essere pubblicati nella sezione ""Amministrazione trasparente""
 d) No, le procedure di affidamento devono aver luogo nel rispetto degli atti di programmazione
 "
361,"Qual è la soglia di rilevanza europea, indicata all'art.14 del D.Lgs. 36/2023, per gli appalti pubblici di lavori e per le concessioni?",d,"a) affidamento diretto per lavori di importo inferiore a 150.000 euro, anche senza consultazione di più operatori economici
 b) Prima dell'avvio delle procedure di affidamento
 c) L'idoneità professionale; la capacità economica e finanziaria; le capacità tecniche e professionali
 d) Euro 5.382.000
 "
362,Qual è l'importo unitario delle procedure contenute nel programma biennale di forniture e servizi?,d,"a) No, il limite temporale è diversificato proprio in funzione della procedura
 b) Serve per rilevare il superamento delle soglie comunitarie
 c) La possibilità di una concorrenza effettiva e sono accompagnati da specifiche che consentono l'efficace verifica delle informazioni fornite dagli offerenti, al fine di valutare il grado di soddisfacimento dei criteri di aggiudicazione delle offerte
 d) Pari o superiore a 40.000 euro
 "
363,Qual è l'intento del legislatore in relazione al Codice dei contratti Pubblici?,a,"a) L'intento del legislatore è quello di separare nettamente la fase di scelta del contraente, retta da regole pubblicistiche, che culmina nell'aggiudicazione, dalla fase di stipulazione del contratto, retta da regole di diritto privato
 b) L'Accordo Quadro consiste in un accordo, concluso tra una stazione appaltante e uno o più operatori economici, il cui scopo è quello di stabilire le condizioni base (prezzi, qualità, quantità) dei successivi appalti (specifici) che saranno aggiudicati dalle singole amministrazioni durante un dato periodo
 c) Trasparenza e tracciabilità dell'intero processo d'acquisto
 d) Si tratta di una procedura di scelta del contraente in cui qualsiasi operatore economico può chiedere di partecipare in base ad un bando di gara o ad un avviso di indizione di gara, ma le stazioni appaltanti avviano un dialogo solo con gli operatori che, sulla base delle informazioni fornite, vengono invitate
 "
364,Qual è una delle principali attività delle Centrali di committenza?,c,"a) Un codice alfanumerico univoco e obbligatorio che identifica una gara d'appalto
 b) Le Amministrazioni abilitate possono acquistare i beni e servizi offerti da fornitori abilitati per valori inferiori alla soglia comunitaria
 c) La conclusione di accordi quadro per lavori, forniture o servizi destinati a stazioni appaltanti
 d) Nelle procedure aperte tutti gli operatori economici possono partecipare alla gara, mentre in quelle ristrette la procedura di aggiudicazione si svolge tra operatori economici che sono già stati selezionati e invitati dall'Amministrazione aggiudicatrice
 "
365,Quale è il criterio di aggiudicazione usato per i contratti legati ai servizi di ristorazione ospedaliera?,b,"a) Prima dell'avvio delle procedure di affidamento
 b) L'offerta economicamente più vantaggiosa
 c) La possibilità di una concorrenza effettiva e sono accompagnati da specifiche che consentono l'efficace verifica delle informazioni fornite dagli offerenti, al fine di valutare il grado di soddisfacimento dei criteri di aggiudicazione delle offerte
 d) Prima dell'avvio delle procedure di affidamento
 "
366,Quale è il valore massimo per il criterio di aggiudicazione al minor prezzo?,b,"a) Serve per rilevare il superamento delle soglie comunitarie
 b) Un milione di euro
 c) 35 giorni dalla pubblicazione del bando
 d) La possibilità di una concorrenza effettiva e sono accompagnati da specifiche che consentono l'efficace verifica delle informazioni fornite dagli offerenti, al fine di valutare il grado di soddisfacimento dei criteri di aggiudicazione delle offerte
 "
367,Quale è l'importo per l' acquisizione di beni e servizi sottosoglia nei settori ordinari da parte delle Amministrazioni che non sono Autorità governative centrali?,a,"a) 215.000,00 euro al netto dell'IVA
 b) Si, secondo le modalita' e i criteri stabiliti dal codice dei contratti
 c) No, gli acquisti in MEPA devono essere fatti al di sotto la soglia minima comunitaria
 d) l'ordine d'acquisto (OdA) e la richiesta d'offerta (RdO)
 "
368,"Quale alternativa di risposta contiene il sistema di scelta ordinario del contraente in cui ogni operatore economico può presentare una domanda di partecipazione, in risposta ad un avviso di indizione di una gara, fornendo le informazioni richieste dall'amministrazione aggiudicatrice, ai fini della selezione qualitativa?",a,"a) Procedura ristretta
 b) Entro cinque giorni dall'adozione del provvedimento
 c) Entro cinque giorni dall'adozione del provvedimento
 d) La domanda di partecipazione; il documento di gara unico europeo; l'offerta; ogni altro documento richiesto per la partecipazione alla procedura di gara
 "
369,Quale criterio di aggiudicazione si può applicare in caso di appalto di lavori di importo inferiore ad un milione di euro?,c,"a) La possibilità di una concorrenza effettiva e sono accompagnati da specifiche che consentono l'efficace verifica delle informazioni fornite dagli offerenti, al fine di valutare il grado di soddisfacimento dei criteri di aggiudicazione delle offerte
 b) E' basato sull'importo totale pagabile, al netto dell'IVA, dall'Amministrazione compresa qualsiasi forma di opzione e rinnovo contrattuale
 c) Il minor prezzo e l'offerta economicamente più vantaggiosa
 d) Il Documento di gara unico europeo (DGUE) che consiste in un'autodichiarazione aggiornata come prova documentale preliminare in sostituzione dei certificati rilasciati da autorità pubbliche o terzi in cui il concorrente conferma le situazioni giuridiche ed i criteri di selezione fissati dal D.Lgs. 50/2016 e s.m.i. al fine di partecipare ad una gara d'appalto
 "
370,Quale di questi NON è un elemento essenziale del contratto?,d,"a) il responsabile unico del procedimento
 b) Recesso, sospensione, risoluzione
 c) Serve per rilevare il superamento delle soglie comunitarie
 d) Termine
 "
371,Quale ente si occupa di determinare le linee guida per le procedure negoziate?,d,"a) il responsabile unico del procedimento
 b) Deve usare conti correnti postali o bancari dedicati alle commesse pubbliche, anche in via non esclusiva
 c) L'Autorità Nazionale Anticorruzione (ANAC)
 d) Anac
 "
372,Quale ente si occupa di stabilire le modalità di dettaglio per la formazione degli elenchi degli operatori economici?,c,"a) Il criterio del prezzo più basso ovvero il criterio della offerta economicamente più vantaggiosa
 b) Il RUP si avvale del direttore dei lavori, del coordinatore in materia di salute e sicurezza durante la fase di esecuzione secondo la normativa prevista nonché del collaudatore e del verificatore della conformità
 c) L'ANAC con proprie linee guida stabilisce le modalità di dettaglio per la formazione e gestione degli elenchi degli operatori economici
 d) È pubblicato sul profilo del committente, sul sito informatico del Ministero delle infrastrutture e dei trasporti e dell'Osservatorio dei contratti pubblici
 "
373,Quale ente si occupa di stabilire le modalità di dettaglio per la formazione degli elenchi degli operatori economici?,d,"a) Il criterio del prezzo più basso ovvero il criterio della offerta economicamente più vantaggiosa
 b) Il RUP si avvale del direttore dei lavori, del coordinatore in materia di salute e sicurezza durante la fase di esecuzione secondo la normativa prevista nonché del collaudatore e del verificatore della conformità
 c) È pubblicato sul profilo del committente, sul sito informatico del Ministero delle infrastrutture e dei trasporti e dell'Osservatorio dei contratti pubblici
 d) L'ANAC con proprie linee guida stabilisce le modalità di dettaglio per la formazione e gestione degli elenchi degli operatori economici
 "
374,Quale normativa regola i rapporti tra Consip spa e il Mef?,a,"a) Art.26, Legge 488/99 e successive modificazioni
 b) L'Autorità di vigilanza sui contratti pubblici di lavori, servizi e forniture su richiesta della stazione appaltante
 c) La possibilità di una concorrenza effettiva e sono accompagnati da specifiche che consentono l'efficace verifica delle informazioni fornite dagli offerenti, al fine di valutare il grado di soddisfacimento dei criteri di aggiudicazione delle offerte
 d) Gli elementi essenziali del contratto e i criteri di selezione degli operatori economici e delle offerte
 "
375,Quale organo adotta le linee guida in materia di contratti pubblici?,a,"a) L'ANAC
 b) il responsabile unico del procedimento
 c) Deve usare conti correnti postali o bancari dedicati alle commesse pubbliche, anche in via non esclusiva
 d) Prima dell'avvio delle procedure di affidamento
 "
376,Quale soggetto definisce periodicamente il valore degli appalti sottosoglia?,d,"a) Serve per rilevare il superamento delle soglie comunitarie
 b) Gli elementi essenziali del contratto e i criteri di selezione degli operatori economici e delle offerte
 c) Le modalità di gara e le clausole contrattuali essenziali
 d) La Commissione europea, con apposito provvedimento
 "
377,"Quale soggetto, tra quelli elencati di seguito, svolge i compiti di vigilanza e controllo sui contratti pubblici e l'attività di regolazione degli stessi?",a,"a) L'Autorità Nazionale Anticorruzione (ANAC)
 b) Deve usare conti correnti postali o bancari dedicati alle commesse pubbliche, anche in via non esclusiva
 c) Sì, nei limiti delle proprie competenze professionali, a condizione che sia in possesso del titolo di studio, della formazione e dell'esperienza professionale necessaria e che non intervengano cause ostative alla coincidenza delle figure indicate nelle citate Linee guida
 d) Sono soggette al Codice dei contratti pubblici, al fine di tutelare la concorrenza anche fra enti del terzo settore, ove il servizio sia prospetticamente svolto dall'affidatario in forma onerosa
 "
378,Quale tra le seguenti è una procedura in cui le stazioni appaltanti consultano gli operatori economici da loro scelti e negoziano con uno o più di essi le condizioni dell'appalto?,a,"a) Procedure negoziate
 b) Partenariato per l'innovazione
 c) Procedura competitiva con negoziazione
 d) Nei casi in cui l'Amministrazione dia il via ad una procedura negoziata, al fine di motivare la scelta di questo tipo di procedura
 "
379,Quale tra le seguenti fasi della procedura ad evidenza pubblica viene per prima rispetto alle altre?,b,"a) Aggiudicazione e stipula del contratto
 b) Determinazione a contrattare
 c) Si, è vincolante per il periodo indicato nel bando o nell'invito e, in caso di mancata indicazione, per centottanta giorni dalla scadenza del termine per la sua presentazione
 d) Non vi è decadenza della commissione, che rimane in carica
 "
380,Quale tra le seguenti fasi della procedura ad evidenza pubblica viene per prima rispetto alle altre?,b,"a) Aggiudicazione e stipula del contratto
 b) Pubblicazione del bando di gara
 c) Si, è vincolante per il periodo indicato nel bando o nell'invito e, in caso di mancata indicazione, per centottanta giorni dalla scadenza del termine per la sua presentazione
 d) Non vi è decadenza della commissione, che rimane in carica
 "
381,Quale tra le seguenti fasi della procedura ad evidenza pubblica viene per prima rispetto alle altre?,d,"a) Aggiudicazione e stipula del contratto
 b) Si, è vincolante per il periodo indicato nel bando o nell'invito e, in caso di mancata indicazione, per centottanta giorni dalla scadenza del termine per la sua presentazione
 c) Non vi è decadenza della commissione, che rimane in carica
 d) Scelta del contraente
 "
382,Quale tra le seguenti fasi della procedura ad evidenza pubblica viene per prima rispetto alle altre?,d,"a) Aggiudicazione e stipula del contratto
 b) Si, è vincolante per il periodo indicato nel bando o nell'invito e, in caso di mancata indicazione, per centottanta giorni dalla scadenza del termine per la sua presentazione
 c) Non vi è decadenza della commissione, che rimane in carica
 d) Determinazione a contrattare
 "
383,Quale tra le seguenti fasi della procedura ad evidenza pubblica viene per prima rispetto alle altre?,b,"a) Aggiudicazione e stipula del contratto
 b) Scelta del contraente
 c) Si, è vincolante per il periodo indicato nel bando o nell'invito e, in caso di mancata indicazione, per centottanta giorni dalla scadenza del termine per la sua presentazione
 d) Non vi è decadenza della commissione, che rimane in carica
 "
384,Quale tra le seguenti fasi della procedura ad evidenza pubblica viene per ultima rispetto alle altre?,b,"a) Non vi è decadenza della commissione, che rimane in carica
 b) Aggiudicazione e stipula del contratto
 c) Il criterio del prezzo più basso ovvero il criterio della offerta economicamente più vantaggiosa
 d) Attività di natura tecnica relativa alla valutazione delle offerte presentate
 "
385,"Quali contratti richiedono per il loro perfezionamento, oltre al consenso dei contraenti, la consegna del bene oggetto del contratto?",a,"a) I contratti reali
 b) deve costituire una garanzia denominata ""garanzia definitiva""
 c) Recesso, sospensione, risoluzione
 d) Prima dell'avvio delle procedure di affidamento
 "
386,"Quali funzioni ha assunto, a seguito dell'entrata in vigore della Legge 11 agosto 2014, n. 114, di conversione del decreto legge 24 giugno 2014, n.90, la nuova Autorità Nazionale Anticorruzione?",c,"a) le stazioni appaltanti favoriscono l'inserimento nel contratto di clausole di rinegoziazione
 b) non è ammissibile ove l'appalto consequenziale comporti modifiche sostanziali alla tipologia delle prestazioni previste nell'accordo
 c) Ha assorbito le funzioni e le risorse dell'ex Autorità per la vigilanza sui contratti pubblici di lavori, servizi e forniture (AVCP)
 d) nei documenti di gara iniziali delle procedure di affidamento è obbligatorio l'inserimento delle clausole di revisione prezzi
 "
387,Quali istituti possono incidere sulla produzione di effetti del contratto stipulato?,d,"a) Serve per rilevare il superamento delle soglie comunitarie
 b) La decadenza dell'assegnatario
 c) Gli elementi essenziali del contratto e i criteri di selezione degli operatori economici e delle offerte
 d) Recesso, sospensione, risoluzione
 "
388,"Quali procedure di scelta del contraente prevista dal Codice dei contratti pubblici consiste in un processo per fasi successive basato su un dispositivo elettronico di presentazione di nuovi prezzi modificati al ribasso o di nuovi valori riguardanti taluni elementi delle offerte, che interviene dopo una prima valutazione completa delle offerte permettendo che la loro classificazione possa essere effettuata sulla base di un trattamento automatico?",a,"a) Asta elettronica
 b) A una commissione giudicatrice
 c) La commissione giudicatrice
 d) Procedura ristretta
 "
389,Quali sono gli elementi che costituiscono la Determina a contrarre?,b,"a) L'Autorità di vigilanza sui contratti pubblici di lavori, servizi e forniture su richiesta della stazione appaltante
 b) La modalità di gara e le clausole contrattuali essenziali
 c) Gli elementi essenziali del contratto e i criteri di selezione degli operatori economici e delle offerte
 d) Nei casi in cui l'Amministrazione dia il via ad una procedura negoziata, al fine di motivare la scelta di questo tipo di procedura
 "
390,Quali sono gli elementi che costituiscono la Determina?,c,"a) L'Accordo Quadro consiste in un accordo, concluso tra una stazione appaltante e uno o più operatori economici, il cui scopo è quello di stabilire le condizioni base (prezzi, qualità, quantità) dei successivi appalti (specifici) che saranno aggiudicati dalle singole amministrazioni durante un dato periodo
 b) Trasparenza e tracciabilità dell'intero processo d'acquisto
 c) La modalità di gara e le clausole contrattuali essenziali
 d) Gli elementi essenziali del contratto e i criteri di selezione degli operatori economici e delle offerte
 "
391,Quali sono i contenuti obbligatori della determinazione a contrarre?,c,"a) Gli appaltatori di lavori, i prestatori di servizi, i fornitori, i subappaltatori e i subcontraenti della filiera delle imprese, nonché i concessionari di finanziamenti pubblici anche europei a qualsiasi titolo interessati ai lavori, ai servizi e alle forniture
 b) quando occorre attivare il procedimento per l'individuazione del contraente
 c) Gli elementi essenziali del contratto e i criteri di selezione degli operatori economici e delle offerte
 d) I ""contratti attivi"" sono quelli dai quali deriva un'entrata per lo Stato e che non producono spesa
 "
392,Quali sono i criteri di aggiudicazione che la Pubblica Amministrazione può utilizzare per individuare l'offerta aggiudicataria ?,c,"a) Se nessuna delle offerte ricevute risulti conveniente o idonea in relazione all'oggetto del contratto
 b) Nel caso in cui nessuna delle offerte ricevute risulti conveniente o idonea in relazione all'oggetto del contratto
 c) Il criterio del prezzo più basso ovvero il criterio della offerta economicamente più vantaggiosa
 d) riservata a coloro che siano stati invitati a partecipare dalla stessa Pubblica Amministrazione
 "
393,"Quali sono i principi secondo cui si svolge l'affidamento e l'esecuzione di appalti di opere, lavori, servizi, forniture e concessioni?",a,"a) Economicità, efficacia, tempestività e correttezza
 b) Procedura negoziata, senza previa pubblicazione di un bando di gara
 c) Si, sono tenuti a rispettare gli obblighi stabiliti dalla normativa europea e nazionale e dai contratti collettivi
 d) Sì, sono tenuti a rispettare gli obblighi stabiliti dalla normativa europea e nazionale e dai contratti collettivi
 "
394,Quali sono i requisiti di ordine speciale ai sensi dell'art.100 comma 1 del D.Lgs.36/2023?,a,"a) L'idoneità professionale; la capacità economica e finanziaria; le capacità tecniche e professionali
 b) L'Autorità di vigilanza sui contratti pubblici di lavori, servizi e forniture su richiesta della stazione appaltante
 c) le stazioni appaltanti favoriscono l'inserimento nel contratto di clausole di rinegoziazione
 d) Prima dell'avvio delle procedure di affidamento dei contratti pubblici, le stazioni appaltanti, in conformita' ai propri ordinamenti, decretano o determinano di contrarre
 "
395,Quali sono i soggetti tenuti all'obbligo della tracciabilità?,a,"a) Gli appaltatori di lavori, i prestatori di servizi, i fornitori, i subappaltatori e i subcontraenti della filiera delle imprese, nonché i concessionari di finanziamenti pubblici anche europei a qualsiasi titolo interessati ai lavori, ai servizi e alle forniture
 b) Deve usare conti correnti postali o bancari dedicati alle commesse pubbliche, anche in via non esclusiva
 c) Gli elementi essenziali del contratto e i criteri di selezione degli operatori economici e delle offerte
 d) La possibilità di una concorrenza effettiva e sono accompagnati da specifiche che consentono l'efficace verifica delle informazioni fornite dagli offerenti, al fine di valutare il grado di soddisfacimento dei criteri di aggiudicazione delle offerte
 "
396,"Quali sono le irregolarità ""non sanabili"" a mezzo del Soccorso istruttorio?",c,"a) No, il limite temporale è diversificato proprio in funzione della procedura
 b) L'Autorità di vigilanza sui contratti pubblici di lavori, servizi e forniture su richiesta della stazione appaltante
 c) Le carenze della documentazione che non consentono l'individuazione del contenuto o del soggetto responsabile della stessa e le carenze di elementi dell'offerta tecnica ed economica
 d) Solo nel caso in cui l'importo dell'affidamento sia inferiore ai 40.000 euro e con una adeguata motivazione
 "
397,Quali sono le procedure di acquisto attraverso le quali il mercato elettronico offre alle Amministrazioni la possibilità di concludere contratti?,c,"a) Nelle procedure aperte tutti gli operatori economici possono partecipare alla gara, mentre in quelle ristrette la procedura di aggiudicazione si svolge tra operatori economici che sono già stati selezionati e invitati dall'Amministrazione aggiudicatrice
 b) Il criterio del prezzo più basso ovvero il criterio della offerta economicamente più vantaggiosa
 c) l'ordine d'acquisto (OdA) e la richiesta d'offerta (RdO)
 d) Procedure aperte (D.lgs. 36/2023 e s.m.i.)
 "
398,"Quali, tra i segenti settori, rientra nei settori speciali di cui al titolo VI, Capo I del Codice dei Contratti pubblici?",b,"a) L'Autorità di vigilanza sui contratti pubblici di lavori, servizi e forniture su richiesta della stazione appaltante
 b) Gas ed Energia termica, Elettricità ed Acqua
 c) Si tratta di una procedura di scelta del contraente in cui qualsiasi operatore economico può chiedere di partecipare in base ad un bando di gara o ad un avviso di indizione di gara, ma le stazioni appaltanti avviano un dialogo solo con gli operatori che, sulla base delle informazioni fornite, vengono invitate
 d) L'idoneità professionale; la capacità economica e finanziaria; le capacità tecniche e professionali
 "
399,"Qualsiasi soggetto, pubblico o privato, che affida contratti di appalto di lavori, servizi e forniture e che è comunque tenuto, nella scelta del contraente, al rispetto del Codice dei contratti pubblici è:",c,"a) Tra l'altro mediante un avviso periodico indicativo, che viene pubblicato in maniera continuativa
 b) Entro cinque giorni dall'adozione del provvedimento
 c) una stazione appaltante
 d) Prima dell'avvio delle procedure di affidamento
 "
400,Quando avviene la nomina dei commissari che compongono la commissione aggiudicatrice?,c,"a) Non vi è decadenza della commissione, che rimane in carica
 b) La stazione appaltante tra i membri della commissione
 c) Dopo la scadenza del termine fissato per la presentazione dell'offerta
 d) Il criterio del prezzo più basso ovvero il criterio della offerta economicamente più vantaggiosa
 "
401,"Quando i lavori, le forniture o i servizi possono essere forniti unicamente da un determinato operatore economico per una delle ragioni indicate dal codice appalti, le amministrazioni aggiudicatrici possono aggiudicare appalti pubblici mediante:",a,"a) Procedura negoziata senza previa pubblicazione di un bando di gara
 b) verifica esclusivamente il possesso da parte dell'aggiudicatario dei requisiti economici e finanziari e tecnico-professionali
 c) decretano o determinano di contrarre, individuando gli elementi essenziali del contratto e i criteri di selezione degli operatori economici e delle offerte
 d) decretano o determinano di contrarre, individuando gli elementi essenziali del contratto e i criteri di selezione degli operatori economici e delle offerte
 "
402,Quando il contratto si considera concluso?,d,"a) L'Accordo Quadro consiste in un accordo, concluso tra una stazione appaltante e uno o più operatori economici, il cui scopo è quello di stabilire le condizioni base (prezzi, qualità, quantità) dei successivi appalti (specifici) che saranno aggiudicati dalle singole amministrazioni durante un dato periodo
 b) Il codice CIG - Codice Identificativo di Gara - è il codice che identifica il singolo affidamento nell'ambito del progetto ed è divenuto ora obbligatorio, ai fini della tracciabilità dei flussi finanziari, in relazione a ciascun contratto pubblico avente ad oggetto lavori, servizi e forniture, a prescindere dall'importo dello stesso e dalla procedura di affidamento prescelta
 c) Il codice CUP (Codice Unitario di Progetto) è obbligatorio solamente con riguardo ad ""ogni nuovo progetto di investimento pubblico""
 d) Quando chi ha fatto la proposta ha conoscenza dell'accettazione dell'altra parte
 "
403,Quando il Rup può agire in deroga all'impedimento della stipula del contratto?,a,"a) Solo in casi di urgenza
 b) Recesso, sospensione, risoluzione
 c) Serve per rilevare il superamento delle soglie comunitarie
 d) La decadenza dell'assegnatario
 "
404,"Quando si hanno più appalti aggiudicati in lotti, come si determina il valore del contratto pubblico?",b,"a) Per favorire l'accesso delle microimprese, piccole e medie imprese
 b) Il valore è determinato dalla totalità dei lotti
 c) Sì, l'appaltatore/operatore può indicare più conti correnti dedicati per un singolo appalto pubblico
 d) Serve per rilevare il superamento delle soglie comunitarie
 "
405,Quando viene adottata la determinazione a contrarre?,a,"a) quando occorre attivare il procedimento per l'individuazione del contraente
 b) Gli elementi essenziali del contratto e i criteri di selezione degli operatori economici e delle offerte
 c) Quando chi ha fatto la proposta ha conoscenza dell'accettazione dell'altra parte
 d) Il codice CIG - Codice Identificativo di Gara - è il codice che identifica il singolo affidamento nell'ambito del progetto ed è divenuto ora obbligatorio, ai fini della tracciabilità dei flussi finanziari, in relazione a ciascun contratto pubblico avente ad oggetto lavori, servizi e forniture, a prescindere dall'importo dello stesso e dalla procedura di affidamento prescelta
 "
406,Se ad una delle parti è attribuita la facolta' di recedere dal contratto questa puo' essere esercitata finchè il contratto:,a,"a) Non abbia avuto un principio di esecuzione
 b) Sia previsto dalla legge o dal contratto medesimo
 c) Deve riportare, tra l'altro, i criteri di selezione del contraente
 d) Deve indicare, tra l'altro, i criteri di selezione delle offerte
 "
