Id,Domanda,Opzione corretta,Opzioni
0,A chi è demandata la valutazione dell'offerta di lavori qualora si proceda con il criterio dell'offerta economicamente più vantaggiosa?,d,"a) Si, è vincolante per il periodo indicato nel bando o nell'invito e, in caso di mancata indicazione, per centottanta giorni dalla scadenza del termine per la sua presentazione
 b) No, l''unico criterio di aggiudicazione è il prezzo più basso
 c) Darne una motivazione adeguata e indicare nel bando il criterio applicato ai fini della selezione della migliore offerta
 d) A una commissione giudicatrice
 "
1,"A cosa è tenuto l'operatore economico che partecipa ad una gara, ai sensi della normativa sulla tracciabilità dei flussi finanziari?",d,"a) La possibilità di una concorrenza effettiva e sono accompagnati da specifiche che consentono l'efficace verifica delle informazioni fornite dagli offerenti, al fine di valutare il grado di soddisfacimento dei criteri di aggiudicazione delle offerte
 b) il numero delle procedure aggiudicate con il criterio dell'offerta economicamente più vantaggiosa rispetto al totale delle procedure
 c) affidamento diretto per lavori di importo inferiore a 150.000 euro, anche senza consultazione di più operatori economici
 d) Deve usare conti correnti postali o bancari dedicati alle commesse pubbliche, anche in via non esclusiva
 "
2,"A fronte dell'iniziativa di una stazione appaltante relativamente a questioni insorte durante lo svolgimento della gara stessa, l'A.N.A.C. è tenuta ad esprimere un parere:",d,"a) Entro cinque giorni dall'adozione del provvedimento
 b) No, non equivale ad accettazione dell'offerta
 c) Sì, Su richiesta del RUP
 d) vincolante
 "
3,"A norma del Codice dei contratti pubblici e degli appalti, chi si trovi in stato di fallimento può partecipare a gare pubbliche d'appalto?",c,"a) Si, devono essere pubblicati nella sezione ""Amministrazione trasparente""
 b) Entro cinque giorni dall'adozione del provvedimento
 c) No, mai
 d) No, non equivale ad accettazione dell'offerta
 "
4,A norma delle Legge 136 del 2010 chi attribuisce il Codice identificativo di gara (CIG)?,c,"a) Si tratta di una procedura di scelta del contraente in cui qualsiasi operatore economico può chiedere di partecipare in base ad un bando di gara o ad un avviso di indizione di gara, ma le stazioni appaltanti avviano un dialogo solo con gli operatori che, sulla base delle informazioni fornite, vengono invitate
 b) L'idoneità professionale; la capacità economica e finanziaria; le capacità tecniche e professionali
 c) L'Autorità di vigilanza sui contratti pubblici di lavori, servizi e forniture su richiesta della stazione appaltante
 d) Prima dell'avvio delle procedure di affidamento dei contratti pubblici, le stazioni appaltanti, in conformita' ai propri ordinamenti, decretano o determinano di contrarre
 "
5,A norma di quanto dispone il Codice dei contratti pubblici in quale momento le stazioni appaltanti decretano o determinano di contrarre e individuano i criteri di selezione degli operatori economici?,b,"a) Tra l'altro mediante un avviso periodico indicativo, che viene pubblicato in maniera continuativa
 b) Prima dell'avvio delle procedure di affidamento
 c) Partenariato per l'innovazione - Dialogo competitivo
 d) è indicato nel bando o nell'avviso
 "
6,A norma di quanto dispone il Codice dei contratti pubblici in quale momento le stazioni appaltanti decretano o determinano di contrarre?,b,"a) La garanzia è progressivamente svincolata a misura dell'avanzamento dell'esecuzione, nel limite massimo dell'80% dell'iniziale importo garantito, senza necessità di nulla osta del committente, ma con preventiva consegna degli stati di avanzamento lavori o documenti analoghi, attestanti l'avvenuta esecuzione
 b) Prima dell'avvio delle procedure di affidamento
 c) Unicamente le procedure di accreditamento c.d. libero e le procedure di co-progettazione e partenariato finalizzate a rapporti puramente gratuiti
 d) Il valore è determinato dalla totalità dei lotti
 "
7,A norma di quanto dispone il Codice dei contratti pubblici in quale momento le stazioni appaltanti individuano gli elementi essenziali del contratto?,a,"a) Prima dell'avvio delle procedure di affidamento
 b) Deve essere effettuato non oltre 6 mesi dopo l'ultimazione dei lavori, salvo casi particolari
 c) La garanzia è progressivamente svincolata a misura dell'avanzamento dell'esecuzione, nel limite massimo dell'80% dell'iniziale importo garantito, senza necessità di nulla osta del committente, ma con preventiva consegna degli stati di avanzamento lavori o documenti analoghi, attestanti l'avvenuta esecuzione
 d) 95.000 Euro
 "
8,A norma di quanto dispone il Codice dei contratti pubblici in quale momento le stazioni appaltanti individuano i criteri di selezione degli operatori economici?,c,"a) Tra l'altro mediante un avviso periodico indicativo, che viene pubblicato in maniera continuativa
 b) Si, lo prevede espressamente il Codice dei contratti pubblici senza rinunciare al livello qualitativo delle prestazioni
 c) Prima dell'avvio delle procedure di affidamento
 d) Entro cinque giorni dall'adozione del provvedimento
 "
9,A norma di quanto dispone il Codice dei contratti pubblici in quale momento le stazioni appaltanti individuano i criteri di selezione delle offerte?,a,"a) Prima dell'avvio delle procedure di affidamento
 b) Tra l'altro mediante un avviso periodico indicativo, che viene pubblicato in maniera continuativa
 c) Si, lo prevede espressamente il Codice dei contratti pubblici senza rinunciare al livello qualitativo delle prestazioni
 d) Una valutazione equa ed imparziale dei concorrenti e l'eliminazione di ostacoli o restrizioni nella predisposizione delle offerte e nella loro valutazione
 "
10,A norma di quanto dispone il Codice dei contratti pubblici in quale momento le stazioni appaltanti individuano i criteri di selezione delle offerte?,d,"a) Tra l'altro mediante un avviso periodico indicativo, che viene pubblicato in maniera continuativa
 b) Si, lo prevede espressamente il Codice dei contratti pubblici senza rinunciare al livello qualitativo delle prestazioni
 c) Si, sempre
 d) Prima dell'avvio delle procedure di affidamento
 "
11,"A norma di quanto dispone il Codice dei contratti pubblici, in quale momento le stazioni appaltanti decretano o determinano di contrarre?",c,"a) Deve essere effettuato non oltre 6 mesi dopo l'ultimazione dei lavori, salvo casi particolari
 b) La garanzia è progressivamente svincolata a misura dell'avanzamento dell'esecuzione, nel limite massimo dell'80% dell'iniziale importo garantito, senza necessità di nulla osta del committente, ma con preventiva consegna degli stati di avanzamento lavori o documenti analoghi, attestanti l'avvenuta esecuzione
 c) Prima dell'avvio delle procedure di affidamento
 d) limitata e determinata nel bando di gara dall'amministrazione aggiudicatrice o dall'ente aggiudicatore in funzione dei lavori o servizi richiesti al concessionario
 "
12,A quale dei seguenti istituti può ricorrere l'operatore economico carente dei requisiti tecnico professionali ed economico finanziari richiesti per la partecipazione ad una gara d'appalto?,c,"a) Procedura ristretta
 b) all'avvalimento
 c) Avvalimento
 d) Procedura ristretta
 "
13,"A seguito di verifica di inadempienza nel regolare adempimento degli obblighi contrattuali del contraente generale verso i propri affidatari, il soggetto aggiudicatore:",b,"a) sono resi disponibili in forma digitale, in modo gratuito, illimitato e diretto
 b) applica una detrazione sui successivi pagamenti e procede al pagamento diretto all'affidatario, nonché applica le eventuali diverse sanzioni previste nel contratto
 c) regole di diritto privato
 d) dell'affidamento diretto, della procedura aperta, della procedura negoziata o della procedura negoziata con un solo operatore
 "
14,"Ai fini del Codice dei contratti pubblici, le procedure intese a fornire alle stazioni appaltanti, nel settore dell'architettura, dell'ingegneria, del restauro e della tutela dei beni culturali e archeologici, della pianificazione urbanistica e territoriale, paesaggistica, naturalistica, geologica, del verde urbano e del paesaggio forestale agronomico, nonché nel settore della messa in sicurezza e della mitigazione degli impatti idrogeologici ed idraulici e dell'elaborazione di dati, un piano o un progetto, selezionato da una commissione giudicatrice in base a una gara, con o senza assegnazione di premi costituiscono:",a,"a) I concorsi di progettazione
 b) linee guida, bandi-tipo, capitolati-tipo, contratti-tipo ed altri strumenti di regolazione flessibile, comunque denominati
 c) verifica esclusivamente il possesso da parte dell'aggiudicatario dei requisiti economici e finanziari e tecnico-professionali
 d) decretano o determinano di contrarre, individuando gli elementi essenziali del contratto e i criteri di selezione degli operatori economici e delle offerte
 "
15,"Ai fini del Codice dei contratti pubblici, per ""candidato"" si intende:",d,"a) Un processo per fasi successive basato su un dispositivo elettronico di presentazione di nuovi prezzi modificati al ribasso o di nuovi valori riguardanti taluni elementi delle offerte, che interviene dopo una prima valutazione completa delle offerte permettendo che la loro classificazione possa essere effettuata sulla base di un trattamento automatico
 b) Indicare il Mercato Elettronico per la Pubblica Amministrazione messo a disposizione dalla CONSIP SPA per gli acquisti inferiori alle soglie comunitarie (art 35 D.Lgs 50/16)da parte della Pubblica Amministrazione
 c) dal responsabile unico del procedimento, congiuntamente al direttore dei lavori, per i lavori, o dal direttore dell'esecuzione del contratto, per i servizi e le forniture
 d) Un operatore economico che ha sollecitato un invito o è stato invitato a partecipare a una procedura ristretta, a una procedura competitiva con negoziazione, a una procedura negoziata senza previa pubblicazione di un bando di gara, a un dialogo competitivo o a un partenariato per l'innovazione o ad una procedura per l'aggiudicazione di una concessione
 "
16,"Ai fini del Codice dei contratti pubblici, per ""offerente"" si intende:",d,"a) Un operatore economico che ha sollecitato un invito o è stato invitato a partecipare a una procedura ristretta, a una procedura competitiva con negoziazione, a una procedura negoziata senza previa pubblicazione di un bando di gara, a un dialogo competitivo o a un partenariato per l'innovazione o ad una procedura per l'aggiudicazione di una concessione
 b) Un processo per fasi successive basato su un dispositivo elettronico di presentazione di nuovi prezzi modificati al ribasso o di nuovi valori riguardanti taluni elementi delle offerte, che interviene dopo una prima valutazione completa delle offerte permettendo che la loro classificazione possa essere effettuata sulla base di un trattamento automatico
 c) Indicare il Mercato Elettronico per la Pubblica Amministrazione messo a disposizione dalla CONSIP SPA per gli acquisti inferiori alle soglie comunitarie (art 35 D.Lgs 50/16)da parte della Pubblica Amministrazione
 d) L'operatore economico che ha presentato un'offerta
 "
17,"Ai fini del Codice dei contratti, l'operatore economico che ha presentato un'offerta assume la denominazione di:",b,"a) La domanda di partecipazione; il documento di gara unico europeo; l'offerta; ogni altro documento richiesto per la partecipazione alla procedura di gara
 b) offerente
 c) No, mai
 d) Un operatore economico che ha sollecitato un invito o è stato invitato a partecipare a una procedura ristretta, a una procedura competitiva con negoziazione, a una procedura negoziata senza previa pubblicazione di un bando di gara, a un dialogo competitivo o a un partenariato per l'innovazione o ad una procedura per l'aggiudicazione di una concessione
 "
18,Ai sensi del Codice dei Contratti la concessione di lavori:,a,"a) è una delle tipologie di contratto utilizzabile dalle pubbliche amministrazioni
 b) contestualmente all'adozione di ogni SAL e comunque entro un termine non superiore a sette giorni dall'adozione degli stessi
 c) Un processo per fasi successive basato su un dispositivo elettronico di presentazione di nuovi prezzi modificati al ribasso o di nuovi valori riguardanti taluni elementi delle offerte, che interviene dopo una prima valutazione completa delle offerte permettendo che la loro classificazione possa essere effettuata sulla base di un trattamento automatico
 d) La garanzia è progressivamente svincolata a misura dell'avanzamento dell'esecuzione, nel limite massimo dell'80% dell'iniziale importo garantito, senza necessità di nulla osta del committente, ma con preventiva consegna degli stati di avanzamento lavori o documenti analoghi, attestanti l'avvenuta esecuzione
 "
19,"Ai sensi del Codice dei contratti pubblici, prima dell'avvio delle procedure di affidamento dei contratti pubblici, le stazioni appaltanti:",a,"a) decretano o determinano di contrarre, individuando gli elementi essenziali del contratto e i criteri di selezione degli operatori economici e delle offerte
 b) verifica esclusivamente il possesso da parte dell'aggiudicatario dei requisiti economici e finanziari e tecnico-professionali
 c) pubblicano un avviso di indizione di gara precisando che si tratta di un sistema dinamico di acquisizione
 d) E' costituta da un numero dispari di commissari, non superiore a cinque
 "
20,"Ai sensi del Codice dei contratti, l'aggiudicazione definitiva diventa efficace:",c,"a) Deve indicare, tra l'altro, i criteri di selezione delle offerte
 b) alla natura, all'oggetto e alle caratteristiche del contratto
 c) dopo la verifica del possesso dei prescritti requisiti
 d) Deve indicare, tra l'altro, quanto indicato nelle altre alternative di risposta
 "
21,"Ai sensi del D.Lgs. 36/2023 Art. 140 comma 1, in circostanze di somma urgenza e senza indugio può essere disposta la immediata esecuzione dei lavori entro il limite di:",b,"a) affidamento diretto per lavori di importo inferiore a 150.000 euro, anche senza consultazione di più operatori economici
 b) 500.000 euro o di quanto indispensabile per rimuovere lo stato di pregiudizio alla pubblica e privata incolumità
 c) sono resi disponibili in forma digitale, in modo gratuito, illimitato e diretto
 d) a quattro anni, salvo casi eccezionali debitamente motivati
 "
22,"Ai sensi dell'art. 101 comma 1 del D.Lgs.36/2023, in merito al soccorso istruttorio al fine di far integrare agli operatori economici la documentazione mancante , ad esclusione della documentazione che compone l'offerta tecnica e l'offerta economica, la stazione appaltante assegna un termine :",a,"a) non inferiore a 5 giorni e non superiore a 10 giorni
 b) La domanda di partecipazione; il documento di gara unico europeo; l'offerta; ogni altro documento richiesto per la partecipazione alla procedura di gara
 c) sono resi disponibili in forma digitale, in modo gratuito, illimitato e diretto
 d) dal responsabile dell'unità organizzativa competente per l'intervento
 "
23,Ai sensi dell'art. 1322 c.c. le parti possono liberamente determinare:,c,"a) Sia previsto dalla legge o dal contratto medesimo
 b) entro trenta giorni dall'aggiudicazione
 c) Il contenuto del contratto
 d) fissa le regole per lo svolgimento del procedimento di selezione delle offerte
 "
24,"Ai sensi dell'art. 31 del D.Lgs. 36/2023, l'Anagrafe degli operatori economici, a qualunque titolo coinvolti nei contratti pubblici, è istituita presso:",b,"a) Sì, Su richiesta del RUP
 b) l'ANAC
 c) alla Banca dati nazionale dei contratti pubblici
 d) per la procedura ristretta
 "
25,"Ai sensi dell'art. 59 comma del D.Lgs. 36/2023 , l'accordo quadro indica:",b,"a) L'idoneità professionale; la capacità economica e finanziaria; le capacità tecniche e professionali
 b) il valore stimato dell'intera operazione contrattuale
 c) le stazioni appaltanti favoriscono l'inserimento nel contratto di clausole di rinegoziazione
 d) fissa le regole per lo svolgimento del procedimento di selezione delle offerte
 "
26,"Ai sensi dell'art. 59 comma del D.Lgs. 36/2023, l'accordo quadro :",d,"a) le stazioni appaltanti favoriscono l'inserimento nel contratto di clausole di rinegoziazione
 b) fissa le regole per lo svolgimento del procedimento di selezione delle offerte
 c) fissa le regole per lo svolgimento del procedimento di selezione delle offerte
 d) non è ammissibile ove l'appalto consequenziale comporti modifiche sostanziali alla tipologia delle prestazioni previste nell'accordo
 "
27,Ai sensi dell'art. 60 comma 1 del D.Lgs. 36/2023:,a,"a) nei documenti di gara iniziali delle procedure di affidamento è obbligatorio l'inserimento delle clausole di revisione prezzi
 b) L'idoneità professionale; la capacità economica e finanziaria; le capacità tecniche e professionali
 c) fissa le regole per lo svolgimento del procedimento di selezione delle offerte
 d) le stazioni appaltanti favoriscono l'inserimento nel contratto di clausole di rinegoziazione
 "
28,Ai sensi dell'art. 60 comma 5 lettera a del D.Lgs. 36/2023 per far fronte ai maggiori oneri derivanti dalla revisione prezzi le stazioni appaltanti utilizzano:,b,"a) affidamento diretto per lavori di importo inferiore a 150.000 euro, anche senza consultazione di più operatori economici
 b) nel limite del 50 per cento, le risorse appositamente accantonate per imprevisti nel quadro economico di ogni intervento, fatte salve le somme relative agli impegni contrattuali già assunti
 c) Il progetto di fattibilità tecnico-economica e il progetto esecutivo
 d) Deve indicare, tra l'altro, i criteri di selezione delle offerte
 "
29,Ai sensi dell'art. 8 comma 1 del D.Lgs. n. 36/2023 le Pubbliche Amministrazioni sono dotate di autonomia contrattuale e possono concludere qualsiasi contratto:,d,"a) affidamento diretto per lavori di importo inferiore a 150.000 euro, anche senza consultazione di più operatori economici
 b) a quattro anni, salvo casi eccezionali debitamente motivati
 c) nel limite del 50 per cento, le risorse appositamente accantonate per imprevisti nel quadro economico di ogni intervento, fatte salve le somme relative agli impegni contrattuali già assunti
 d) anche gratuito salvi i divieti espressamente previsti dal codice e da altre disposizioni di legge
 "
30,"Ai sensi dell'art. 89 comma 1 del D.Lgs. 36/2023 le stazioni appaltanti invitano simultaneamente e per iscritto, attraverso le piattaforme di approvvigionamento digitale, i candidati selezionati a presentare le rispettive offerte o a negoziare oppure a partecipare al dialogo:",d,"a) La domanda di partecipazione; il documento di gara unico europeo; l'offerta; ogni altro documento richiesto per la partecipazione alla procedura di gara
 b) No
 c) No, le procedure di affidamento devono aver luogo nel rispetto degli atti di programmazione
 d) nelle procedure ristrette, nel dialogo competitivo, nei partenariati per l'innovazione, nelle procedure competitive con negoziazione
 "
31,"Ai sensi dell'art. 90 comma 1 lettera d del D.Lgs. 36/2023, le stazioni appaltanti entro quanti giorni comunicano l'esclusione ai candidati e agli offerenti esclusi?",a,"a) Entro cinque giorni dall'adozione del provvedimento
 b) sono resi disponibili in forma digitale, in modo gratuito, illimitato e diretto
 c) nelle procedure ristrette, nel dialogo competitivo, nei partenariati per l'innovazione, nelle procedure competitive con negoziazione
 d) un operatore economico cui è stata affidata o aggiudicata una concessione
 "
32,"Ai sensi dell'art. 90, co. 1, lettera e, del D.Lgs. 36/2023 e s.m.i., le stazioni appaltanti entro quanti giorni comunicano la data di avvenuta stipulazione del contratto con l'aggiudicatario a tutti i candidati e concorrenti che hanno presentato un'offerta ammessa in gara?",a,"a) Entro cinque giorni dall'adozione del provvedimento
 b) sono resi disponibili in forma digitale, in modo gratuito, illimitato e diretto
 c) No, non equivale ad accettazione dell'offerta
 d) nelle procedure ristrette, nel dialogo competitivo, nei partenariati per l'innovazione, nelle procedure competitive con negoziazione
 "
33,"Ai sensi dell'art. 90, comma 1, lettera b, del D.Lgs. 36/2023, le stazioni appaltanti entro quanti giorni comunicano l'aggiudicazione all'aggiudicatario?",d,"a) affidamento diretto per lavori di importo inferiore a 150.000 euro, anche senza consultazione di più operatori economici
 b) fissa le regole per lo svolgimento del procedimento di selezione delle offerte
 c) sono resi disponibili in forma digitale, in modo gratuito, illimitato e diretto
 d) Entro cinque giorni dall'adozione del provvedimento
 "
34,"Ai sensi dell'art. 90, comma 1, lettera c, del D.Lgs. 36/2023, le stazioni appaltanti entro quanti giorni comunicano l'aggiudicazione e il nome dell'offerente cui è stato aggiudicato l'appalto o parti dell'accordo quadro a tutti i candidati e concorrenti che hanno presentato un'offerta ammessa in gara?",c,"a) sono resi disponibili in forma digitale, in modo gratuito, illimitato e diretto
 b) Può stabilire che non si proceda all'aggiudicazione, soltanto, tuttavia, qualora di tale facoltà sia stata data indicazione espressa nel bando di gara o nella lettera d'invito
 c) Entro cinque giorni dall'adozione del provvedimento
 d) No, non equivale ad accettazione dell'offerta
 "
35,"Ai sensi dell'art. 92, co. 4, del D.Lgs. 36/2023, se nel corso della procedura di aggiudicazione la stazione appaltante richiede a un operatore economico un adempimento, per il quale non è previsto un termine , in quanto tempo deve adempiere l'operatore?",a,"a) 10 giorni
 b) Entro cinque giorni dall'adozione del provvedimento
 c) Entro cinque giorni dall'adozione del provvedimento
 d) deve costituire una garanzia denominata ""garanzia definitiva""
 "
36,"Ai sensi dell'art. 92, comma 2, lettera b, del D.Lgs.36/2023, i termini per la presentazione delle domande di partecipazione sono prorogati se sono apportate modifiche significative ai documenti di gara?",c,"a) Entro cinque giorni dall'adozione del provvedimento
 b) Entro cinque giorni dall'adozione del provvedimento
 c) Sì, sempre
 d) affidamento diretto per lavori di importo inferiore a 150.000 euro, anche senza consultazione di più operatori economici
 "
37,"Ai sensi dell'art. 93 comma 2 del D.Lgs.36/2023, la Commissione giudicatrice è composta da un numero:",b,"a) è effettuata dopo la scadenza del termine fissato per la presentazione delle offerte
 b) dispari di componenti con un massimo di cinque
 c) alla natura, all'oggetto e alle caratteristiche del contratto
 d) quello dell'offerta economicamente più vantaggiosa o quello del minor prezzo
 "
38,"Ai sensi dell'art. 93 comma3 DEL d.Lgs.36/2023, della Commissione giudicatrice può far parte il RUP?",c,"a) Sì, Su richiesta del RUP
 b) L'idoneità professionale; la capacità economica e finanziaria; le capacità tecniche e professionali
 c) Sì
 d) sono tassative
 "
39,"Ai sensi dell'art. 99 comma 3 del D.Lgs.36/2023, agli operatori economici possono essere richiesti documenti che comprovano il possesso dei requisiti di partecipazione o altra documentazione utile ai fini dell'aggiudicazione, se questi possono essere acquisiti tramite interoperabilità con la piattaforma digitale nazionale dei dati?",a,"a) No
 b) La domanda di partecipazione; il documento di gara unico europeo; l'offerta; ogni altro documento richiesto per la partecipazione alla procedura di gara
 c) all'avvalimento
 d) Procedura ristretta
 "
40,"Ai sensi dell'art. 99, comma 3, del D.Lgs.36/2023, agli operatori economici possono essere richiesti documenti che comprovano il possesso dei requisiti di partecipazione o altra documentazione utile ai fini dell'aggiudicazione, se questi sono già in possesso della stazione appaltante?",a,"a) No
 b) Entro cinque giorni dall'adozione del provvedimento
 c) Tra l'altro mediante un avviso periodico indicativo, che viene pubblicato in maniera continuativa
 d) Entro cinque giorni dall'adozione del provvedimento
 "
41,"Ai sensi dell'art. 99, comma 3, del D.Lgs.36/2023, agli operatori economici possono essere richiesti documenti che comprovano il possesso dei requisiti di partecipazione o altra documentazione utile ai fini dell'aggiudicazione, se questi sono presenti nel fascicolo virtuale dell'operatore economico?",b,"a) Entro cinque giorni dall'adozione del provvedimento
 b) No
 c) La domanda di partecipazione; il documento di gara unico europeo; l'offerta; ogni altro documento richiesto per la partecipazione alla procedura di gara
 d) Entro cinque giorni dall'adozione del provvedimento
 "
42,"Ai sensi dell'art.10 del D.Lgs 36/2023 le stazioni appaltanti possono introdurre requisiti speciali, attinenti e proporzionati all'oggetto del contratto, di carattere:",d,"a) Entro cinque giorni dall'adozione del provvedimento
 b) affidamento diretto per lavori di importo inferiore a 150.000 euro, anche senza consultazione di più operatori economici
 c) Prima dell'avvio delle procedure di affidamento
 d) economico-finanziario e tecnico-professionale
 "
43,"Ai sensi dell'art.55 comma 1 del D.Lgs. 36/2023, la stipulazione de contratto avviene entro:",b,"a) fissa le regole per lo svolgimento del procedimento di selezione delle offerte
 b) entro trenta giorni dall'aggiudicazione
 c) sono resi disponibili in forma digitale, in modo gratuito, illimitato e diretto
 d) fissa le regole per lo svolgimento del procedimento di selezione delle offerte
 "
44,"Ai sensi dell'art.87, co, 1, del D.Lgs. 36/2023 e s.m.i., il disciplinare di gara:",b,"a) sono resi disponibili in forma digitale, in modo gratuito, illimitato e diretto
 b) fissa le regole per lo svolgimento del procedimento di selezione delle offerte
 c) le stazioni appaltanti favoriscono l'inserimento nel contratto di clausole di rinegoziazione
 d) nei documenti di gara iniziali delle procedure di affidamento è obbligatorio l'inserimento delle clausole di revisione prezzi
 "
